policy_id,name,year_recommended,source,status,implementing_body,budget_allocated_ksh_m,budget_utilized_pct,blocking_factor,lives_saved_estimate,notes
P001,Athi River Industrial Drainage Standards,2016,NEMA / Machakos County,Not Enforced,NEMA,55.0,12.0,Industrial lobby resistance and NEMA-county jurisdiction overlap,70,Industrial drainage standards gazetted 2018. Compliance rate estimated 35%. Joint NEMA-county inspection programme collapsed 2020.
P002,Mavoko Stormwater Master Plan,2019,Machakos County / World Bank,Draft Only,Machakos County,0.0,0.0,Not adopted — new county administration deprioritised,85,Plan completed with World Bank support 2021. New county government elected 2022 did not adopt. Re-presented to county assembly 2023.
P003,SGR-Athi River Corridor Drainage,2018,Kenya Railways / KeNHA,Completed,Kenya Railways Corporation,125.0,92.0,None — completed,20,SGR viaduct drainage channels and culverts designed for 1:100 year flood. Surrounding community drainage not covered.
P004,Syokimau Riparian Enforcement,2020,NEMA / Machakos County,Not Enforced,Machakos County,35.0,8.0,Rapid residential development on Athi River floodplain,60,Riparian buffer mapped. Approved residential developments within flood zone documented. County planning approvals not linked to flood risk.
P005,Athi River Early Warning,2021,WRA,Partially Implemented,Water Resources Authority,22.0,64.0,Industrial area alert chain not established,40,Gauge on Athi River functional. Residential community alerts via sub-chief network. Industrial zone emergency coordinators not enrolled.
