policy_id,name,year_recommended,source,status,implementing_body,budget_allocated_ksh_m,budget_utilized_pct,blocking_factor,lives_saved_estimate,notes
P001,Sosiani River Riparian Enforcement,2016,NEMA / Uasin Gishu County,Not Enforced,Uasin Gishu County,55.0,8.0,Dense informal settlement on riparian land — enforcement requires evictions,95,30m buffer consistently violated in Langas and Huruma. County has not issued demolition orders since 2020.
P002,Eldoret Stormwater Master Plan,2018,Uasin Gishu County / AFD,Stalled,Uasin Gishu County,220.0,27.0,French Development Agency conditions not met for disbursement,110,AFD-funded plan developed 2019. Disbursement conditions include financial management reforms not completed. 4 years of delayed implementation.
P003,Sosiani River Early Warning,2019,WRA,Partially Implemented,Water Resources Authority,28.0,68.0,Alert chain to informal settlement communities,60,5 gauges installed. 4-hour warning achievable. Sub-chief network used for alerts — misses renters and new arrivals in Langas.
P004,JKUAT-Eldoret Flood Risk Research Partnership,2021,JKUAT / Uasin Gishu County,Completed,JKUAT,6.0,100.0,None — completed,15,Academic risk mapping complete. Peer-reviewed 2022. Not integrated into county planning approvals process.
P005,Eldoret Northern Bypass Drainage,2020,KeNHA,Partially Implemented,Kenya National Highways Authority,85.0,62.0,Culvert capacity undersized — identified post-construction,40,Bypass built 2021. Three undersized culverts identified in 2022 floods. Remediation design underway.
